fy_book,keyword,has_dollar,snippet
2025,CVN,Y,"S. Navy in 2017. Beginning in 2009, we received contract awards totaling $8.8 billion for construction preparation, detail design, and construction of the second Gerald R. Ford class (CVN 78) aircraft carrier, John F. Kennedy (CVN 79). In addition, we have received contract awards valued at $15.4 billion for detail design and construction of the Gerald R. Ford class (CVN 78) aircraft carriers, Enterprise (CVN 80) and Doris Miller (CVN 81). Enterprise (CVN 80) has received and loaded all major engine room components, allowing for engine room deck over and acceleration of ship erection"
2025,CVN,Y,"8 billion for construction preparation, detail design, and construction of the second Gerald R. Ford class (CVN 78) aircraft carrier, John F. Kennedy (CVN 79). In addition, we have received contract awards valued at $15.4 billion for detail design and construction of the Gerald R. Ford class (CVN 78) aircraft carriers, Enterprise (CVN 80) and Doris Miller (CVN 81). Enterprise (CVN 80) has received and loaded all major engine room components, allowing for engine room deck over and acceleration of ship erection, which reached 50% complete in 2025. Doris"
2025,CVN,Y,"Ford class (CVN 78) aircraft carrier, John F. Kennedy (CVN 79). In addition, we have received contract awards valued at $15.4 billion for detail design and construction of the Gerald R. Ford class (CVN 78) aircraft carriers, Enterprise (CVN 80) and Doris Miller (CVN 81). Enterprise (CVN 80) has received and loaded all major engine room components, allowing for engine room deck over and acceleration of ship erection, which reached 50% complete in 2025. Doris Miller (CVN 81) keel units are currently in fabrication and we continue to receive major material components. The fiscal year 2026 National De"
2025,CVN,Y,"Kennedy (CVN 79). In addition, we have received contract awards valued at $15.4 billion for detail design and construction of the Gerald R. Ford class (CVN 78) aircraft carriers, Enterprise (CVN 80) and Doris Miller (CVN 81). Enterprise (CVN 80) has received and loaded all major engine room components, allowing for engine room deck over and acceleration of ship erection, which reached 50% complete in 2025. Doris Miller (CVN 81) keel units are currently in fabrication and we continue to receive major material components. The fiscal year 2026 National Defense Authorization Act (“NDAA”) provid"
2025,CVN,Y,"For the year ended December 31, 2025, cumulative catch-up revenue adjustments included an unfavorable adjustment of $ 71 million on the construction of Enterprise (CVN 80) and Doris Miller (CVN 81) at the Company's Newport News segment. For each of the years ended December 31, 2024 and 2023, no individual unfavorable cumulative catch-up revenue adjustment was material to the Company's consolidated statements of operations and comprehensive income. The Company’s Newport News segment continues to experience performance challenges in the construction of aircraft carr"
2025,Backlog,Y,"ITEM 3. LEGAL PROCEEDINGS For information regarding legal proceedings, see Note 14: Investigations, Claims, and Litigation in Item 8. Consistent with the requirements of SEC Regulation S-K, Item 103, our threshold for disclosing any environmental legal proceeding involving a governmental authority is potential monetary sanctions that our management believes will exceed $1 million. ITEM 4. MINE S"
2025,Backlog,Y,"BACKLOG Total backlog as of December 31, 2025 and 2024, was approximately $53.1 billion and $48.7 billion, respectively. Total backlog includes both funded backlog (firm orders for which funding is contractually obligated by the customer) and unfunded backlog (firm orders for which funding is not currently contractually obligated by the customer). Backlog excludes unexercised contract options and unfunded indefinite d"
2025,Backlog,Y,"1 billion and $48.7 billion, respectively. Total backlog includes both funded backlog (firm orders for which funding is contractually obligated by the customer) and unfunded backlog (firm orders for which funding is not currently contractually obligated by the customer). Backlog excludes unexercised contract options and unfunded indefinite delivery/indefinite quantity orders. For contracts having no stated contract values, backlog includes only the amounts committed by the customer as of December 31, 2025 and 2024, respectively. 45 Table of Contents The following table prese"
2025,Backlog,Y,"Amortization expense for the years ended December 31, 2025, 2024, and 2023, was $ 104 million, $ 109 million, and $ 128 million, respectively. The Compa"
2025,award,Y,"Following an arbitration proceeding between the parties, in February 2018 the arbitral tribunal awarded the Company approximately $ 151 million on its claims and awarded the Republic approximately $ 22 million on its counterclaims. In November 2023, the Company sold its judgment against the Republic to a third party in exchange for an initial cash payment of $ 70.5 million, recognized in the Ingalls segment's other income and gains, net in the consolidated statements of operations and comprehensive"
