fy_book,keyword,has_dollar,snippet
2022,CVN,Y,"2 billion for construction preparation, detail design, and construction of the second Gerald R. Ford class (CVN 78) aircraft carrier, John F. Kennedy (CVN 79). In addition, we have received awards valued at $15.3 billion for detail design and construction of the Gerald R. Ford class (CVN 78) aircraft carriers Enterprise (CVN 80) and Doris Miller (CVN 81). We continue to be the exclusive prime contractor for nuclear aircraft carrier refueling and complex overhaul (""RCOH""). Each RCOH takes nearly four years to complete, with the work accounting for appr"
2022,CVN,Y,"Ford class (CVN 78) aircraft carrier, John F. Kennedy (CVN 79). In addition, we have received awards valued at $15.3 billion for detail design and construction of the Gerald R. Ford class (CVN 78) aircraft carriers Enterprise (CVN 80) and Doris Miller (CVN 81). We continue to be the exclusive prime contractor for nuclear aircraft carrier refueling and complex overhaul (""RCOH""). Each RCOH takes nearly four years to complete, with the work accounting for approximately 35% of all maintenance and modernization during an aircraft carrier's 50 year service life. RCOH services include propulsion"
2022,CVN,Y,"Kennedy (CVN 79). In addition, we have received awards valued at $15.3 billion for detail design and construction of the Gerald R. Ford class (CVN 78) aircraft carriers Enterprise (CVN 80) and Doris Miller (CVN 81). We continue to be the exclusive prime contractor for nuclear aircraft carrier refueling and complex overhaul (""RCOH""). Each RCOH takes nearly four years to complete, with the work accounting for approximately 35% of all maintenance and modernization during an aircraft carrier's 50 year service life. RCOH services include propulsion work (refueling of reactors; propulsi"
2022,CVN,Y,"In addition, we have received awards valued at $15.3 billion for detail design and construction of the Gerald R. Ford class (CVN 78) aircraft carriers Enterprise (CVN 80) and Doris Miller (CVN 81). We continue to be the exclusive prime contractor for nuclear aircraft carrier refueling and complex overhaul (""RCOH""). Each RCOH takes nearly four years to complete, with the work accounting for approximately 35% of all maintenance and modernization during an aircraft carrier's 50 year service life. RCOH services include propulsion work (refueling of reactors; propulsion plant modernization; an"
2022,CVN,Y,"Kennedy (CVN 79) and the RCOH of USS George Washington (CVN 73). Naval nuclear support service revenues decreased primarily as a result of lower volumes in submarine fleet support services and facility maintenance services, partially offset by higher volumes in carrier fleet support services. Segment Operating Income 2022 - Newport News segment operating income in 2022 was $357 million, compared to segment operating income of $352 million in 2021. The increa"
2022,CVN,Y,"2021 - The value of new contract awards during the year ended December 31, 2021, was approximately $8.1 billion, comprised primarily of awards for the RCOH of USS John C. Stennis (CVN 74), construction of a 10th boat of the Virginia class (SSN 774) submarine program, and construction of John F. Lehma n (DDG 137). LIQUIDITY AND CAPITAL RESOURCES We seek to efficiently convert operating results into cash for deployment in operating our businesses, implementing our business strategy, and maximizing stockholder value. We use various financial measures to assist in capital deployment"
2022,Backlog,Y,"See Note 2: Summary of Significant Accounting Policies in Item 8. Backlog As of December 31, 2022 and 2021, our total backlog was approximately $47.1 billion and $48.5 billion, respectively. We expect approximately 22% of backlog at December 31, 2022, to be converted into sales in 2023. Raw Materials The most significant material we use is steel. Other materials we use in large quantities include paint, aluminum, pipe, electrical cable, and fittings. All of these materials are currently available in adequate supply. In"
2022,Backlog,Y,"Backlog As of December 31, 2022 and 2021, our total backlog was approximately $47.1 billion and $48.5 billion, respectively. We expect approximately 22% of backlog at December 31, 2022, to be converted into sales in 2023. Raw Materials The most significant material we use is steel. Other materials we use in large quantities include paint, aluminum, pipe, electrical cable, and fittings. All of these materials are currently available in adequate supply. In connection with our U."
2022,Backlog,Y,"As of December 31, 2022, our total backlog was $47.1 billion, including $22.2 billion in funded backlog. The U."
2022,Backlog,Y,"BACKLOG Total backlog as of December 31, 2022, was approximately $47.1 billion. Total backlog includes both funded backlog (firm orders for which funding is contractually obligated by the customer) and unfunded backlog (firm orders for which funding is not currently contractually obligated by the customer). Backlog excludes unexercised contract options and unfunded Indefinite Delivery/Indefinite Quantity orders. For c"
2022,Backlog,Y,"In connection with the acquisition of Alion in 2021, the Company recorded $ 720 million of intangible assets pertaining to customer relationships and existing contract backlog, which is being amortized using the pattern of benefits method over a weighted-average life of 15 years. The Company's purchased intangible assets are being amortized on a straight-line basis or a method based on the pattern of benefits over their estimated useful lives. Net intangible assets consist primarily of amounts relating to customer relationships and existing contract backlog within Miss"
2022,Backlog,Y,"Net intangible assets consist primarily of amounts relating to customer relationships and existing contract backlog within Mission Technologies, as well as nuclear-powered aircraft carrier and submarine program intangible assets, with an aggregate weighted-average useful life of 29 years based on the long life cycle of the related programs. Aggregate amortization expense for the years ended December 31, 2022, 2021, and 2020, was $ 140 million, $ 86 million, and $ 56 million, respectively. The Company expects a"
2022,award,Y,"S. Navy, including Lenah H. Sutcliffe Higbee (DDG 123) in 2022, USS Frank E. Petersen Jr. (DDG 121) in 2021, and USS Delbert D. Black (DDG 119) in 2020. In 2013, we were awarded a multi-year contract totaling $3.3 billion for construction of five Arleigh Burke class (DDG 51) destroyers, of which four have been delivered and Jack H. Lucas (DDG 125) is being constructed. In 2018, we were awarded a multi-year contract totaling $5.1 billion for construction of six additional Arleigh Burke class (DDG 51) destroyers. In 2020, we were awarded a contract to 1 construct an additi"
2022,award,Y,"3 billion for construction of five Arleigh Burke class (DDG 51) destroyers, of which four have been delivered and Jack H. Lucas (DDG 125) is being constructed. In 2018, we were awarded a multi-year contract totaling $5.1 billion for construction of six additional Arleigh Burke class (DDG 51) destroyers. In 2020, we were awarded a contract to 1 construct an additional Arleigh Burke class (DDG 51) destroyer. We are currently constructing Ted Stevens (DDG128), Jeremiah Denton (DDG 129), George M. Neal (DDG 131), and Sam Nunn (DDG 133). National Security Cutters The U."
2022,award,Y,"In 2018, we were awarded a multi-year contract totaling $5.1 billion for construction of six additional Arleigh Burke class (DDG 51) destroyers. In 2020, we were awarded a contract to 1 construct an additional Arleigh Burke class (DDG 51) destroyer. We are currently constructing Ted Stevens (DDG128), Jeremiah Denton (DDG 129), George M. Neal (DDG 131), and Sam Nunn (DDG 133). National Security Cutters The U."
2022,award,Y,"Following an arbitration proceeding between the parties, in February 2018 the arbitral tribunal awarded the Company approximately $ 151 million on its claims and awarded the Republic approximately $ 22 million on its counterclaims. The Company is seeking to enforce and execute upon the award in multiple jurisdictions. No assurances can be provided regarding the ultimate resolution of this matter. The Company is party to various other claims, legal proceedings, and investigations that arise in the o"
2023,Virginia,Y,"The House defense appropriations measure broadly supports the President’s budget request for shipbuilding, including funding for two Virginia class (SSN 774) submarines, one Columbia class (SSBN 826) ballistic missile submarine and two Arleigh Burke class (DDG 51) destroyers. The Senate Appropriations Committee included $500 million in advance procurement for LPD 33 (unnamed) and advance procurement for a third Arleigh Burke class (DDG 51) destroyer in fiscal year 2025, as well as full funding for two Arleigh Burke class (DDG 51) destr"
2023,Virginia,Y,"Segment Operating Income Newport News segment operating income in 2023 was $379 million, compared to segment operating income of $357 million in 2022. The increase was due to higher volumes described above and revenue adjustment on the RCOH of USS George Washington (CV"
2023,Virginia,Y,"Cost of product sales in 2023 increased $305 million, or 5%, compared to 2022, consistent with higher product sales described above. Service Revenues and Segm"
2023,Columbia,Y,"Cost of product sales in 2023 increased $305 million, or 5%, compared to 2022, consistent with higher pro"
2023,CVN,Y,"S. Navy in 2017. Beginning in 2009, we received contract awards totaling $8.7 billion for construction preparation, detail design, and construction of the second Gerald R. Ford class (CVN 78) aircraft carrier, John F. Kennedy (CVN 79). In addition, we have received contract awards valued at $15.3 billion for detail design and construction of the Gerald R. Ford class (CVN 78) aircraft carriers Enterprise (CVN 80) and Doris Miller (CVN 81). We continue to be the exclusive prime contractor for nuclear aircraft carrier refueling and complex overhaul (""RCOH""). Each RCOH takes nearly four"
2023,CVN,Y,"7 billion for construction preparation, detail design, and construction of the second Gerald R. Ford class (CVN 78) aircraft carrier, John F. Kennedy (CVN 79). In addition, we have received contract awards valued at $15.3 billion for detail design and construction of the Gerald R. Ford class (CVN 78) aircraft carriers Enterprise (CVN 80) and Doris Miller (CVN 81). We continue to be the exclusive prime contractor for nuclear aircraft carrier refueling and complex overhaul (""RCOH""). Each RCOH takes nearly four years to complete, with the work accounting"
2023,CVN,Y,"Ford class (CVN 78) aircraft carrier, John F. Kennedy (CVN 79). In addition, we have received contract awards valued at $15.3 billion for detail design and construction of the Gerald R. Ford class (CVN 78) aircraft carriers Enterprise (CVN 80) and Doris Miller (CVN 81). We continue to be the exclusive prime contractor for nuclear aircraft carrier refueling and complex overhaul (""RCOH""). Each RCOH takes nearly four years to complete, with the work accounting for approximately 35% of all maintenance and modernization during an aircraft carrier's 50 year service life. RCOH services include propulsion"
2023,CVN,Y,"Kennedy (CVN 79). In addition, we have received contract awards valued at $15.3 billion for detail design and construction of the Gerald R. Ford class (CVN 78) aircraft carriers Enterprise (CVN 80) and Doris Miller (CVN 81). We continue to be the exclusive prime contractor for nuclear aircraft carrier refueling and complex overhaul (""RCOH""). Each RCOH takes nearly four years to complete, with the work accounting for approximately 35% of all maintenance and modernization during an aircraft carrier's 50 year service life. RCOH services include propulsion work (refueling of reactors; propulsi"
2023,CVN,Y,"In addition, we have received contract awards valued at $15.3 billion for detail design and construction of the Gerald R. Ford class (CVN 78) aircraft carriers Enterprise (CVN 80) and Doris Miller (CVN 81). We continue to be the exclusive prime contractor for nuclear aircraft carrier refueling and complex overhaul (""RCOH""). Each RCOH takes nearly four years to complete, with the work accounting for approximately 35% of all maintenance and modernization during an aircraft carrier's 50 year service life. RCOH services include propulsion work (refueling of reactors; propulsion plant modernization; an"
2023,Backlog,Y,"See Note 2: Summary of Significant Accounting Policies in Item 8. Backlog As of December 31, 2023 and 2022, our total backlog was approximately $48.1 billion and $47.1 billion, respectively. We expect approximately 22% of backlog at December 31, 2023, to be converted into sales in 2024. Raw Materials We rely on third parties to provide raw materials. The most significant material we use is steel. Other materials we use in large quantities include paint, aluminum, pipe, electrical cables, electronic components, fittings,"
2023,Backlog,Y,"Backlog As of December 31, 2023 and 2022, our total backlog was approximately $48.1 billion and $47.1 billion, respectively. We expect approximately 22% of backlog at December 31, 2023, to be converted into sales in 2024. Raw Materials We rely on third parties to provide raw materials. The most significant material we use is steel. Other materials we use in large quantities include paint, aluminum, pipe, electrical cables, electronic components, fittings, custom machine items, and sensors. All of these materials are currently available in adequate supply. I"
2023,Backlog,Y,"As of December 31, 2023, our total backlog was $48.1 billion, including $26.0 billion in funded backlog. The U."
2023,Backlog,Y,"We currently do not expect the Framework to have a material impact on our effective tax rate or our consolidated results of operation, financial position, and cash flows. BACKLOG Total backlog as of December 31, 2023, was approximately $48.1 billion. Total backlog includes both funded backlog (firm orders for which funding is contractually obligated by the customer) and unfunded backlog (firm orders for which funding is not currently contractually obligated by the customer). Backlog excludes unexercised contract options and unfunded Indefinite Delivery/Indefinite Quantity orders. For c"
2023,Backlog,Y,"BACKLOG Total backlog as of December 31, 2023, was approximately $48.1 billion. Total backlog includes both funded backlog (firm orders for which funding is contractually obligated by the customer) and unfunded backlog (firm orders for which funding is not currently contractually obligated by the customer). Backlog excludes unexercised contract options and unfunded Indefinite Delivery/Indefinite Quantity orders. For contracts having no stated contract values, backlog includes only the amo"
2023,Backlog,Y,"Net intangible assets consist primarily of amounts relating to customer relationships and existing contract backlog within Mission Technologies, as well as nuclear-powered aircraft carrier and submarine program intangible assets, with an aggregate weighted-average useful life of 29 years based on the long life cycle of the related programs. Aggregate amortization expense for the years ended December 31, 2023, 2022, and 2021, was $ 128 million, $ 140 million, and $ 86 million, respectively. The Company expects"
2023,award,Y,"Following an arbitration proceeding between the parties, in February 2018 the arbitral tribunal awarded the Company approximately $ 151 million on its claims and awarded the Republic approximately $ 22 million on its counterclaims. In November 2023, the Company sold its judgment against the Republic to a third party in exchange for an initial cash payment of $ 70.5 million, recognized in the Ingalls segment's other income and gains, net in the consolidated statements of operations and comprehensive"
2024,Virginia,Y,"The House defense appropriations bill funds the Defense Department within the spending caps in the 2023 debt limit deal and supports the President’s budget request by funding one Virginia class (SSN 774) submarine, two Arleigh Burke class (DDG 51) destroyers, one LPD Flight II amphibious ship, and one CVN RCOH. The Senate Appropriations Committee added approximately $21 billion in emergency funding not subject to the FRA caps and included fiscal year 2025 funding for three Arleigh Burke class (DDG 51) destroyers, one Virginia class (SSN 774) submarine, one LPD Flight II amphibious"
2024,Virginia,Y,A $5.7 billion emergency appropriations anomaly supports fiscal year 2024 and fiscal year 2025 Virginia class submarines as well as workforce wages and shipyard investments. This funding does not count against the FRA fiscal year 2025 funding cap. We cannot predict the outcome of the fiscal year 2025 budget process or whether additional short-term fund
2024,Virginia,Y,"44 Table of Contents Segment Operating Income Newport News segment operating income in 2024 was $246 million, compared to segment operating income of $379 million in 2023. The decrease was primarily driven by low"
2024,Virginia,Y,"Segment cost of product sales in 2024 increased $42 million, or 1%, compared to 2023, primarily due to higher volumes at Ingalls in surface combat"
2024,CVN,Y,"S. Navy in 2017. Beginning in 2009, we received contract awards totaling $8.8 billion for construction preparation, detail design, and construction of the second Gerald R. Ford class (CVN 78) aircraft carrier, John F. Kennedy (CVN 79). In addition, we have received contract awards valued at $15.3 billion for detail design and construction of the Gerald R. Ford class (CVN 78) aircraft carriers, Enterprise (CVN 80) and Doris Miller (CVN 81). We continue to be the exclusive prime contractor for nuclear aircraft carrier refueling and complex overhaul (""RCOH""). Each RCOH takes nearly four"
2024,CVN,Y,"8 billion for construction preparation, detail design, and construction of the second Gerald R. Ford class (CVN 78) aircraft carrier, John F. Kennedy (CVN 79). In addition, we have received contract awards valued at $15.3 billion for detail design and construction of the Gerald R. Ford class (CVN 78) aircraft carriers, Enterprise (CVN 80) and Doris Miller (CVN 81). We continue to be the exclusive prime contractor for nuclear aircraft carrier refueling and complex overhaul (""RCOH""). Each RCOH takes nearly four years to complete, with the work accountin"
2024,CVN,Y,"Ford class (CVN 78) aircraft carrier, John F. Kennedy (CVN 79). In addition, we have received contract awards valued at $15.3 billion for detail design and construction of the Gerald R. Ford class (CVN 78) aircraft carriers, Enterprise (CVN 80) and Doris Miller (CVN 81). We continue to be the exclusive prime contractor for nuclear aircraft carrier refueling and complex overhaul (""RCOH""). Each RCOH takes nearly four years to complete, with the work accounting for approximately 35% of all maintenance and modernization during an aircraft carrier's 50 year service life. RCOH services include propulsio"
2024,CVN,Y,"Kennedy (CVN 79). In addition, we have received contract awards valued at $15.3 billion for detail design and construction of the Gerald R. Ford class (CVN 78) aircraft carriers, Enterprise (CVN 80) and Doris Miller (CVN 81). We continue to be the exclusive prime contractor for nuclear aircraft carrier refueling and complex overhaul (""RCOH""). Each RCOH takes nearly four years to complete, with the work accounting for approximately 35% of all maintenance and modernization during an aircraft carrier's 50 year service life. RCOH services include propulsion work (refueling of reactors; propulsi"
2024,RCOH,Y,"The Senate Appropriations Committee added approximately $21 billion in emergency funding not subject to the FRA caps and included fiscal year 2025 funding for three Arleigh Burke class (DDG 51) destroyers, one Virginia class (SSN 774) submarine, one LPD Flight II amphibious ship, one CVN RCOH, one FFG-62 frigate, and advanced procurement funding for an additional Arleigh Burke class destroyer in"
2024,Backlog,Y,"See Note 2: Summary of Significant Accounting Policies in Item 8. Backlog As of December 31, 2024 and 2023, our total backlog was approximately $48.7 billion and $48.1 billion, respectively. We expect approximately 21% of backlog at December 31, 2024, to be converted into sales in 2025. Raw Materials We rely on third parties to provide raw materials. The most significant material we use is steel. Other materials we use in large quantities include paint, aluminum, pipe, electrical cables, electronic components, fittings,"
2024,Backlog,Y,"Backlog As of December 31, 2024 and 2023, our total backlog was approximately $48.7 billion and $48.1 billion, respectively. We expect approximately 21% of backlog at December 31, 2024, to be converted into sales in 2025. Raw Materials We rely on third parties to provide raw materials. The most significant material we use is steel. Other materials we use in large quantities include paint, aluminum, pipe, electrical cables, electronic components, fittings, custom machine items, and sensors. In connection with our U."
2024,Backlog,Y,"We currently do not expect the Framework to have a material impact on our effective tax rate or our consolidated results of operation, financial position, and cash flows. BACKLOG Total backlog as of December 31, 2024, was approximately $48.7 billion. Total backlog includes both funded backlog (firm orders for which funding is contractually obligated by the customer) and unfunded backlog (firm orders for which funding is not currently contractually obligated by the customer). Backlog excludes unexercised contract options and unfunded indefinite delivery/indefinite quantity orders. For c"
2024,Backlog,Y,"BACKLOG Total backlog as of December 31, 2024, was approximately $48.7 billion. Total backlog includes both funded backlog (firm orders for which funding is contractually obligated by the customer) and unfunded backlog (firm orders for which funding is not currently contractually obligated by the customer). Backlog excludes unexercised contract options and unfunded indefinite delivery/indefinite quantity orders. For contracts having no stated contract values, backlog includes only the amo"
2024,Backlog,Y,"Net intangible assets consist primarily of amounts relating to acquired customer relationships and contract backlog within Mission Technologies, as well as nuclear-powered aircraft carrier and submarine program intangible assets, with an aggregate weighted-average useful life of 29 years based on the long life cycle of the related programs. Amortization expense for the years ended December 31, 2024, 2023, and 2022, was $ 109 million, $ 128 million, and $ 140 million, respectively. The Company expects amortizat"
2024,award,Y,"Following an arbitration proceeding between the parties, in February 2018 the arbitral tribunal awarded the Company approximately $ 151 million on its claims and awarded the Republic approximately $ 22 million on its counterclaims. In November 2023, the Company sold its judgment against the Republic to a third party in exchange for an initial cash payment of $ 70.5 million, recognized in the Ingalls segment's other income and gains, net in the consolidated statements of operations and comprehensive"
2025,Virginia,Y,"Additionally, under the Act, Congress provided mandatory funding of more than $29 billion for Shipbuilding and the Maritime Industrial Base. This funding included one Virginia class (SSN 774) fast attack submarine and two Arleigh-Burke class (DDG 51) guided-missile destroyers, and provided additional funding for amphibious warfare ships and unmanned surface vessels. Overall, the fiscal year 2026 NDAA authorizes $900.6 billion in national security funding. The legislation supports our shipbuilding priorities with a total authorization of $26 billion for shipbuilding pro"
2025,Virginia,Y,"Clinton (CVN 82); continued funding for the RCOH of USS John C. Stennis (CVN 74); funding for the Virginia class (SSN 774) and Columbia class (SSBN 826) submarine programs; advanced procurement for the Arleigh Burke class (DDG 51) program, including additional funding for shipyard infrastructure and wage enhancements; and funding for long-lead-time materials for the new frigate program. Additionally, the bill provides $1.5 billion for the Maritime Industrial Base to invest in critical areas including"
2025,Virginia,Y,"For the year ended December 31, 2025, cumulative catch-up revenue adjustments included significant unfavorable performance adjustments on the construction of aircraft carriers and Virginia class (SSN 774) submarines, which were offset by contract incentives. Sales and Service Revenues Newport News sales and service revenues, including intersegment sales, increased $538 million, or 9%, in 2025 compared to 2024, primarily driven by higher volumes in submarines and aircraft carriers. 41 Table of Contents Segment Operating Income Newport News segment operating income in 2025 was $331 m"
2025,Columbia,Y,"The legislation supports our shipbuilding priorities with a total authorization of $26 billion for shipbuilding programs, including procurement authorization for the third Columbia class (SSBN 826) submarine and advance procurement for future submarines, one Virginia class (SSN 774) fast attack submarine and advance procurement for future submarines, advance procurement for future Arleigh-Burke class (DDG 51) class destroyers, and full funding for the Gerald R. Ford class (CVN 78) aircraft carrier program. Additionally, the fiscal year 2026 NDAA provides authorization for W"
