naics6,desc,primary_vendors_in_dataset,primary_dollars_$M_in_dataset,primary_pct_dollars_in_dataset,category_id,category,rule_strength,candidate_category,mapping_note
332999,All Other Miscellaneous Fabricated Metal Product Manufacturing,16,79.31,0.6,99,Unresolved capability / insufficient evidence,review_trigger,05/07,Generic fabricated-metal code; inspect specific secondary NAICS.
333112,Lawn and Garden Tractor and Home Lawn and Garden Equipment Manufacturing,0,0,0,11,"Industrial machinery, tooling & material handling",direct,,Specific process/product NAICS.
333120,Construction Machinery Manufacturing,1,23.64,0.18,11,"Industrial machinery, tooling & material handling",direct,,Specific process/product NAICS.
333131,Mining Machinery and Equipment Manufacturing,0,0,0,11,"Industrial machinery, tooling & material handling",direct,,Specific process/product NAICS.
333132,Oil and Gas Field Machinery and Equipment Manufacturing,0,0,0,11,"Industrial machinery, tooling & material handling",direct,,Specific process/product NAICS.
333241,Food Product Machinery Manufacturing,0,0,0,11,"Industrial machinery, tooling & material handling",direct,,Specific process/product NAICS.
333242,Semiconductor Machinery Manufacturing,0,0,0,11,"Industrial machinery, tooling & material handling",direct,,Specific process/product NAICS.
333243,"Sawmill, Woodworking, and Paper Machinery Manufacturing",0,0,0,11,"Industrial machinery, tooling & material handling",direct,,Specific process/product NAICS.
333248,All Other Industrial Machinery Manufacturing,2,2.5,0.02,11,"Industrial machinery, tooling & material handling",direct,,Specific process/product NAICS.
333249,Other Industrial Machinery Manufacturing,0,0,0,11,"Industrial machinery, tooling & material handling",direct,,Specific process/product NAICS.
333310,Commercial and Service Industry Machinery Manufacturing,4,61.05,0.47,11,"Industrial machinery, tooling & material handling",broad_direct,,"Broad machinery code, but still a machinery-making capability."
333413,Industrial and Commercial Fan and Blower and Air Purification Equipment Manufacturing,9,41.13,0.31,04,"Thermal management, HVAC & air handling",direct,,Specific process/product NAICS.
333414,Heating Equipment (except Warm Air Furnaces) Manufacturing,6,20.19,0.15,04,"Thermal management, HVAC & air handling",direct,,Specific process/product NAICS.
333415,Air-Conditioning and Warm Air Heating Equipment and Commercial and Industrial Refrigeration Equipment Manufacturing,6,394.57,3.01,04,"Thermal management, HVAC & air handling",direct,,Specific process/product NAICS.
333511,Industrial Mold Manufacturing,0,0,0,11,"Industrial machinery, tooling & material handling",direct,,Specific process/product NAICS.
333514,"Special Die and Tool, Die Set, Jig, and Fixture Manufacturing",0,0,0,11,"Industrial machinery, tooling & material handling",direct,,Specific process/product NAICS.
333515,Cutting Tool and Machine Tool Accessory Manufacturing,0,0,0,11,"Industrial machinery, tooling & material handling",direct,,Specific process/product NAICS.
333517,MACHINE TOOL MANUFACTURING,6,19.3,0.15,11,"Industrial machinery, tooling & material handling",direct,,Specific process/product NAICS.
333519,Rolling Mill and Other Metalworking Machinery Manufacturing,0,0,0,11,"Industrial machinery, tooling & material handling",direct,,Specific process/product NAICS.
333611,Turbine and Turbine Generator Set Units Manufacturing,5,54.78,0.42,02,"Propulsion, engines & mechanical power transmission",direct,,Specific process/product NAICS.
333612,"Speed Changer, Industrial High-Speed Drive, and Gear Manufacturing",3,173.06,1.32,02,"Propulsion, engines & mechanical power transmission",direct,,Specific process/product NAICS.
333613,Mechanical Power Transmission Equipment Manufacturing,4,40.66,0.31,02,"Propulsion, engines & mechanical power transmission",direct,,Specific process/product NAICS.
333618,Other Engine Equipment Manufacturing,1,0.59,0.0,02,"Propulsion, engines & mechanical power transmission",direct,,Specific process/product NAICS.
333912,Air and Gas Compressor Manufacturing,3,60.42,0.46,03,"Fluid systems, flow control & piping",direct,,Specific process/product NAICS.
333914,"Measuring, Dispensing, and Other Pumping Equipment Manufacturing",10,520.81,3.97,03,"Fluid systems, flow control & piping",direct,,Specific process/product NAICS.
333921,Elevator and Moving Stairway Manufacturing,0,0,0,11,"Industrial machinery, tooling & material handling",direct,,Specific process/product NAICS.
333922,Conveyor and Conveying Equipment Manufacturing,0,0,0,11,"Industrial machinery, tooling & material handling",direct,,Specific process/product NAICS.
333923,"Overhead Traveling Crane, Hoist, and Monorail System Manufacturing",3,9.83,0.07,11,"Industrial machinery, tooling & material handling",direct,,Specific process/product NAICS.
333924,"Industrial Truck, Tractor, Trailer, and Stacker Machinery Manufacturing",3,1.16,0.01,11,"Industrial machinery, tooling & material handling",direct,,Specific process/product NAICS.
333991,Power-Driven Handtool Manufacturing,0,0,0,11,"Industrial machinery, tooling & material handling",direct,,Specific process/product NAICS.
333992,Welding and Soldering Equipment Manufacturing,3,14.33,0.11,11,"Industrial machinery, tooling & material handling",direct,,Specific process/product NAICS.
333993,Packaging Machinery Manufacturing,0,0,0,11,"Industrial machinery, tooling & material handling",direct,,Specific process/product NAICS.
333994,Industrial Process Furnace and Oven Manufacturing,1,0.48,0.0,04,"Thermal management, HVAC & air handling",direct,,Specific process/product NAICS.
333995,Fluid Power Cylinder and Actuator Manufacturing,5,76.18,0.58,03,"Fluid systems, flow control & piping",direct,,Specific process/product NAICS.
333996,Fluid Power Pump and Motor Manufacturing,1,0.46,0.0,03,"Fluid systems, flow control & piping",direct,,Specific process/product NAICS.
333998,All Other Miscellaneous General Purpose Machinery Manufacturing,6,56.49,0.43,99,Unresolved capability / insufficient evidence,review_trigger,11,Generic machinery code; inspect specific secondary NAICS.
333999,All Other Miscellaneous General Purpose Machinery Manufacturing,1,0.94,0.01,99,Unresolved capability / insufficient evidence,review_trigger,11,Generic machinery code; inspect specific secondary NAICS.
334111,Electronic Computer Manufacturing,16,29.21,0.22,09,"Electronic components, computers, interconnects & cable",direct,,Specific process/product NAICS.
334112,Computer Storage Device Manufacturing,0,0,0,09,"Electronic components, computers, interconnects & cable",direct,,Specific process/product NAICS.
334118,Computer Terminal and Other Computer Peripheral Equipment Manufacturing,4,4.14,0.03,09,"Electronic components, computers, interconnects & cable",direct,,Specific process/product NAICS.
334210,Telephone Apparatus Manufacturing,0,0,0,10,"Sensors, instrumentation, controls & communications",direct,,Specific process/product NAICS.
334220,Radio and Television Broadcasting and Wireless Communications Equipment Manufacturing,7,41.73,0.32,10,"Sensors, instrumentation, controls & communications",direct,,Specific process/product NAICS.
334290,Other Communications Equipment Manufacturing,4,34.87,0.27,10,"Sensors, instrumentation, controls & communications",direct,,Specific process/product NAICS.
334310,Audio and Video Equipment Manufacturing,1,0.55,0.0,10,"Sensors, instrumentation, controls & communications",direct,,Specific process/product NAICS.
334412,Bare Printed Circuit Board Manufacturing,1,0.7,0.01,09,"Electronic components, computers, interconnects & cable",direct,,Specific process/product NAICS.
334413,Semiconductor and Related Device Manufacturing,0,0,0,09,"Electronic components, computers, interconnects & cable",direct,,Specific process/product NAICS.
334416,"Capacitor, Resistor, Coil, Transformer, and Other Inductor Manufacturing",1,100.78,0.77,09,"Electronic components, computers, interconnects & cable",direct,,Specific process/product NAICS.
334417,Electronic Connector Manufacturing,9,118.69,0.91,09,"Electronic components, computers, interconnects & cable",direct,,Specific process/product NAICS.
334418,Printed Circuit Assembly (Electronic Assembly) Manufacturing,5,5.71,0.04,09,"Electronic components, computers, interconnects & cable",direct,,Specific process/product NAICS.
334419,Other Electronic Component Manufacturing,9,98.78,0.75,09,"Electronic components, computers, interconnects & cable",direct,,Specific process/product NAICS.
334510,Electromedical and Electrotherapeutic Apparatus Manufacturing,0,0,0,10,"Sensors, instrumentation, controls & communications",direct,,Specific process/product NAICS.
334511,"Search, Detection, Navigation, Guidance, Aeronautical, and Nautical System and Instrument Manufacturing",14,153.56,1.17,10,"Sensors, instrumentation, controls & communications",direct,,Specific process/product NAICS.
334512,"Automatic Environmental Control Manufacturing for Residential, Commercial, and Appliance Use",1,0.66,0.01,04,"Thermal management, HVAC & air handling",direct,,Specific process/product NAICS.
334513,"Instruments and Related Products Manufacturing for Measuring, Displaying, and Controlling Industrial Process Variables",19,70.6,0.54,10,"Sensors, instrumentation, controls & communications",direct,,Specific process/product NAICS.
334514,Totalizing Fluid Meter and Counting Device Manufacturing,0,0,0,10,"Sensors, instrumentation, controls & communications",direct,,Specific process/product NAICS.
334515,Instrument Manufacturing for Measuring and Testing Electricity and Electrical Signals,10,107.73,0.82,10,"Sensors, instrumentation, controls & communications",direct,,Specific process/product NAICS.
334516,Analytical Laboratory Instrument Manufacturing,1,1.13,0.01,10,"Sensors, instrumentation, controls & communications",direct,,Specific process/product NAICS.
334517,Irradiation Apparatus Manufacturing,0,0,0,10,"Sensors, instrumentation, controls & communications",direct,,Specific process/product NAICS.
334519,Other Measuring and Controlling Device Manufacturing,8,15.2,0.12,10,"Sensors, instrumentation, controls & communications",direct,,Specific process/product NAICS.
334610,Manufacturing and Reproducing Magnetic and Optical Media,0,0,0,09,"Electronic components, computers, interconnects & cable",direct,,Specific process/product NAICS.
335132,"Commercial, Industrial, and Institutional Electric Lighting Fixture Manufacturing",2,2.66,0.02,01,"Electrical power equipment, conversion & distribution",direct,,Specific process/product NAICS.
335139,Electric Lamp Bulb and Other Lighting Equipment Manufacturing,0,0,0,01,"Electrical power equipment, conversion & distribution",direct,,Specific process/product NAICS.
335220,Major Household Appliance Manufacturing,0,0,0,18,"Interiors, safety gear & miscellaneous manufactured products",direct,,Specific process/product NAICS.
335311,"Power, Distribution, and Specialty Transformer Manufacturing",11,579.98,4.42,01,"Electrical power equipment, conversion & distribution",direct,,Specific process/product NAICS.
335312,Motor and Generator Manufacturing,6,2160.5,16.48,01,"Electrical power equipment, conversion & distribution",direct,,Specific process/product NAICS.
335313,Switchgear and Switchboard Apparatus Manufacturing,7,226.6,1.73,01,"Electrical power equipment, conversion & distribution",direct,,Specific process/product NAICS.
335314,Relay and Industrial Control Manufacturing,3,5.14,0.04,01,"Electrical power equipment, conversion & distribution",direct,,Specific process/product NAICS.
335910,Battery Manufacturing,1,4.36,0.03,01,"Electrical power equipment, conversion & distribution",direct,,Specific process/product NAICS.
335921,Fiber Optic Cable Manufacturing,0,0,0,09,"Electronic components, computers, interconnects & cable",direct,,Specific process/product NAICS.
335929,Other Communication and Energy Wire Manufacturing,4,17.96,0.14,09,"Electronic components, computers, interconnects & cable",direct,,Specific process/product NAICS.
335931,Current-Carrying Wiring Device Manufacturing,3,4.41,0.03,09,"Electronic components, computers, interconnects & cable",direct,,Specific process/product NAICS.
335932,Noncurrent-Carrying Wiring Device Manufacturing,0,0,0,09,"Electronic components, computers, interconnects & cable",direct,,Specific process/product NAICS.
335991,Carbon and Graphite Product Manufacturing,0,0,0,08,"Polymers, elastomers, composites & formulated materials",direct,,Specific process/product NAICS.
335999,All Other Miscellaneous Electrical Equipment and Component Manufacturing,11,97.44,0.74,99,Unresolved capability / insufficient evidence,review_trigger,01/09,Generic electrical-equipment code; inspect power vs electronics evidence.
336120,Heavy Duty Truck Manufacturing,0,0,0,99,Unresolved capability / insufficient evidence,review_trigger,05/11,Transportation end-market code; inspect process codes.
336211,Motor Vehicle Body Manufacturing,0,0,0,99,Unresolved capability / insufficient evidence,review_trigger,05,Transportation end-market/body fabrication; inspect process codes.
336212,Truck Trailer Manufacturing,0,0,0,99,Unresolved capability / insufficient evidence,review_trigger,05,Transportation end-market/trailer fabrication; inspect process codes.
336310,Motor Vehicle Gasoline Engine and Engine Parts Manufacturing,0,0,0,02,"Propulsion, engines & mechanical power transmission",direct,,Specific process/product NAICS.
336320,Motor Vehicle Electrical and Electronic Equipment Manufacturing,0,0,0,09,"Electronic components, computers, interconnects & cable",direct,,Specific process/product NAICS.
336330,Motor Vehicle Steering and Suspension Components (except Spring) Manufacturing,0,0,0,02,"Propulsion, engines & mechanical power transmission",direct,,Specific process/product NAICS.
336340,Motor Vehicle Brake System Manufacturing,0,0,0,02,"Propulsion, engines & mechanical power transmission",direct,,Specific process/product NAICS.
336350,Motor Vehicle Transmission and Power Train Parts Manufacturing,0,0,0,02,"Propulsion, engines & mechanical power transmission",direct,,Specific process/product NAICS.
336360,Motor Vehicle Seating and Interior Trim Manufacturing,0,0,0,18,"Interiors, safety gear & miscellaneous manufactured products",direct,,Specific process/product NAICS.
336390,Other Motor Vehicle Parts Manufacturing,0,0,0,99,Unresolved capability / insufficient evidence,review_trigger,02/05/07/09,Generic vehicle-parts code; inspect process codes.
336411,Aircraft Manufacturing,1,1.0,0.01,99,Unresolved capability / insufficient evidence,review_trigger,specific process category,Aircraft end-market code; inspect process codes.
336412,Aircraft Engine and Engine Parts Manufacturing,6,349.83,2.67,02,"Propulsion, engines & mechanical power transmission",direct,,Specific process/product NAICS.
336413,Other Aircraft Parts and Auxiliary Equipment Manufacturing,13,33.6,0.26,99,Unresolved capability / insufficient evidence,review_trigger,specific process category,Aircraft-parts end-market code; inspect process codes.
336414,Guided Missile and Space Vehicle Manufacturing,1,2.24,0.02,99,Unresolved capability / insufficient evidence,review_trigger,12,Missile/space end-market code; process-specific codes override.
336415,Guided Missile and Space Vehicle Propulsion Unit and Propulsion Unit Parts Manufacturing,2,6.2,0.05,02,"Propulsion, engines & mechanical power transmission",direct,,Specific process/product NAICS.
336419,Other Guided Missile and Space Vehicle Parts and Auxiliary Equipment Manufacturing,2,13.2,0.1,99,Unresolved capability / insufficient evidence,review_trigger,12 or specific process category,Missile/space-parts end-market code; inspect process codes.
336510,Railroad Rolling Stock Manufacturing,0,0,0,99,Unresolved capability / insufficient evidence,review_trigger,05/11,Rail end-market code; inspect process codes.
336611,Ship Building and Repairing,43,1203.02,9.18,13,"Shipyard work, marine integration & outfitting",weak_end_market,,Use 13 only for genuine shipyard/major marine integration; specific process secondaries override.
336612,Boat Building,2,9.79,0.07,13,"Shipyard work, marine integration & outfitting",weak_end_market,,Use 13 only for genuine boat/shipyard integration; specific process secondaries override.
336991,"Motorcycle, Bicycle, and Parts Manufacturing",0,0,0,99,Unresolved capability / insufficient evidence,review_trigger,specific process category,Transportation end-market code; inspect process codes.
336992,"Military Armored Vehicle, Tank, and Tank Component Manufacturing",2,86.98,0.66,99,Unresolved capability / insufficient evidence,review_trigger,12 or 05,Armored-vehicle end-market code; structural/process codes often more informative.
336999,All Other Transportation Equipment Manufacturing,0,0,0,99,Unresolved capability / insufficient evidence,review_trigger,12 or specific process category,Generic transportation-equipment code; inspect process codes.
337110,Wood Kitchen Cabinet and Countertop Manufacturing,0,0,0,18,"Interiors, safety gear & miscellaneous manufactured products",direct_family,,Finished interior/wood/paper/textile/furniture product family.
337127,Institutional Furniture Manufacturing,1,1.74,0.01,18,"Interiors, safety gear & miscellaneous manufactured products",direct_family,,Finished interior/wood/paper/textile/furniture product family.
337211,Wood Office Furniture Manufacturing,0,0,0,18,"Interiors, safety gear & miscellaneous manufactured products",direct_family,,Finished interior/wood/paper/textile/furniture product family.
337212,Custom Architectural Woodwork and Millwork Manufacturing,0,0,0,18,"Interiors, safety gear & miscellaneous manufactured products",direct_family,,Finished interior/wood/paper/textile/furniture product family.
337214,Office Furniture (except Wood) Manufacturing,0,0,0,18,"Interiors, safety gear & miscellaneous manufactured products",direct_family,,Finished interior/wood/paper/textile/furniture product family.
337215,"Showcase, Partition, Shelving, and Locker Manufacturing",0,0,0,18,"Interiors, safety gear & miscellaneous manufactured products",direct_family,,Finished interior/wood/paper/textile/furniture product family.
339112,Surgical and Medical Instrument Manufacturing,0,0,0,18,"Interiors, safety gear & miscellaneous manufactured products",direct,,Specific process/product NAICS.
339113,Surgical Appliance and Supplies Manufacturing,2,4.35,0.03,18,"Interiors, safety gear & miscellaneous manufactured products",direct,,Specific process/product NAICS.
339114,Dental Equipment and Supplies Manufacturing,0,0,0,18,"Interiors, safety gear & miscellaneous manufactured products",direct,,Specific process/product NAICS.
339115,Ophthalmic Goods Manufacturing,0,0,0,18,"Interiors, safety gear & miscellaneous manufactured products",direct,,Specific process/product NAICS.
339920,Sporting and Athletic Goods Manufacturing,1,0.5,0.0,18,"Interiors, safety gear & miscellaneous manufactured products",direct,,Specific process/product NAICS.
339940,Office Supplies (except Paper) Manufacturing,0,0,0,18,"Interiors, safety gear & miscellaneous manufactured products",direct,,Specific process/product NAICS.
339950,Sign Manufacturing,1,0.35,0.0,18,"Interiors, safety gear & miscellaneous manufactured products",direct,,Specific process/product NAICS.
339991,"Gasket, Packing, and Sealing Device Manufacturing",0,0,0,08,"Polymers, elastomers, composites & formulated materials",direct,,Specific process/product NAICS.
339993,"Fastener, Button, Needle, and Pin Manufacturing",0,0,0,07,"Precision machining, hardware & metal finishing",direct,,Specific process/product NAICS.
339994,"Broom, Brush, and Mop Manufacturing",0,0,0,18,"Interiors, safety gear & miscellaneous manufactured products",direct,,Specific process/product NAICS.
339999,All Other Miscellaneous Manufacturing,11,110.29,0.84,99,Unresolved capability / insufficient evidence,review_trigger,18 or specific manufacturing category,Miscellaneous manufacturing code is not capability-specific.
423120,Motor Vehicle Supplies and New Parts Merchant Wholesalers,0,0,0,16,"Distribution, logistics, rental & commercial supply",business_model,,Wholesale/retail/logistics/rental business model.
423140,Motor Vehicle Parts (Used) Merchant Wholesalers,0,0,0,16,"Distribution, logistics, rental & commercial supply",business_model,,Wholesale/retail/logistics/rental business model.
423210,Furniture Merchant Wholesalers,0,0,0,16,"Distribution, logistics, rental & commercial supply",business_model,,Wholesale/retail/logistics/rental business model.
423220,Home Furnishing Merchant Wholesalers,0,0,0,16,"Distribution, logistics, rental & commercial supply",business_model,,Wholesale/retail/logistics/rental business model.
423310,"Lumber, Plywood, Millwork, and Wood Panel Merchant Wholesalers",3,5.1,0.04,16,"Distribution, logistics, rental & commercial supply",business_model,,Wholesale/retail/logistics/rental business model.
423320,"Brick, Stone, and Related Construction Material Merchant Wholesalers",0,0,0,16,"Distribution, logistics, rental & commercial supply",business_model,,Wholesale/retail/logistics/rental business model.
423330,"Roofing, Siding, and Insulation Material Merchant Wholesalers",0,0,0,16,"Distribution, logistics, rental & commercial supply",business_model,,Wholesale/retail/logistics/rental business model.
423390,Other Construction Material Merchant Wholesalers,0,0,0,16,"Distribution, logistics, rental & commercial supply",business_model,,Wholesale/retail/logistics/rental business model.
423410,Photographic Equipment and Supplies Merchant Wholesalers,0,0,0,16,"Distribution, logistics, rental & commercial supply",business_model,,Wholesale/retail/logistics/rental business model.
423420,Office Equipment Merchant Wholesalers,0,0,0,16,"Distribution, logistics, rental & commercial supply",business_model,,Wholesale/retail/logistics/rental business model.
423430,Computer and Computer Peripheral Equipment and Software Merchant Wholesalers,9,6.24,0.05,16,"Distribution, logistics, rental & commercial supply",business_model,,Wholesale/retail/logistics/rental business model.
423440,Other Commercial Equipment Merchant Wholesalers,0,0,0,16,"Distribution, logistics, rental & commercial supply",business_model,,Wholesale/retail/logistics/rental business model.
423450,"Medical, Dental, and Hospital Equipment and Supplies Merchant Wholesalers",0,0,0,16,"Distribution, logistics, rental & commercial supply",business_model,,Wholesale/retail/logistics/rental business model.
423460,Ophthalmic Goods Merchant Wholesalers,0,0,0,16,"Distribution, logistics, rental & commercial supply",business_model,,Wholesale/retail/logistics/rental business model.
423490,Other Professional Equipment and Supplies Merchant Wholesalers,1,0.22,0.0,16,"Distribution, logistics, rental & commercial supply",business_model,,Wholesale/retail/logistics/rental business model.
423510,Metal Service Centers and Other Metal Merchant Wholesalers,5,8.34,0.06,16,"Distribution, logistics, rental & commercial supply",business_model,,Wholesale/retail/logistics/rental business model.
423610,"Electrical Apparatus and Equipment, Wiring Supplies, and Related Equipment Merchant Wholesalers",12,34.58,0.26,16,"Distribution, logistics, rental & commercial supply",business_model,,Wholesale/retail/logistics/rental business model.
423620,"Household Appliances, Electric Housewares, and Consumer Electronics Merchant Wholesalers",0,0,0,16,"Distribution, logistics, rental & commercial supply",business_model,,Wholesale/retail/logistics/rental business model.
423690,Other Electronic Parts and Equipment Merchant Wholesalers,7,14.64,0.11,16,"Distribution, logistics, rental & commercial supply",business_model,,Wholesale/retail/logistics/rental business model.
423710,Hardware Merchant Wholesalers,2,2.78,0.02,16,"Distribution, logistics, rental & commercial supply",business_model,,Wholesale/retail/logistics/rental business model.
423720,Plumbing and Heating Equipment and Supplies (Hydronics) Merchant Wholesalers,0,0,0,16,"Distribution, logistics, rental & commercial supply",business_model,,Wholesale/retail/logistics/rental business model.
423730,Warm Air Heating and Air-Conditioning Equipment and Supplies Merchant Wholesalers,0,0,0,16,"Distribution, logistics, rental & commercial supply",business_model,,Wholesale/retail/logistics/rental business model.
423740,Refrigeration Equipment and Supplies Merchant Wholesalers,1,0.24,0.0,16,"Distribution, logistics, rental & commercial supply",business_model,,Wholesale/retail/logistics/rental business model.
423810,Construction and Mining (except Oil Well) Machinery and Equipment Merchant Wholesalers,1,0.21,0.0,16,"Distribution, logistics, rental & commercial supply",business_model,,Wholesale/retail/logistics/rental business model.
423820,Farm and Garden Machinery and Equipment Merchant Wholesalers,0,0,0,16,"Distribution, logistics, rental & commercial supply",business_model,,Wholesale/retail/logistics/rental business model.
423830,Industrial Machinery and Equipment Merchant Wholesalers,13,32.13,0.25,16,"Distribution, logistics, rental & commercial supply",business_model,,Wholesale/retail/logistics/rental business model.
423840,Industrial Supplies Merchant Wholesalers,13,13.28,0.1,16,"Distribution, logistics, rental & commercial supply",business_model,,Wholesale/retail/logistics/rental business model.
423850,Service Establishment Equipment and Supplies Merchant Wholesalers,0,0,0,16,"Distribution, logistics, rental & commercial supply",business_model,,Wholesale/retail/logistics/rental business model.
423860,Transportation Equipment and Supplies (except Motor Vehicle) Merchant Wholesalers,2,2.53,0.02,16,"Distribution, logistics, rental & commercial supply",business_model,,Wholesale/retail/logistics/rental business model.
