anchor_id,parameter,value,basis,source_title,source_url,quoted_text
A1,h - outsourceable labor-hour share,0.50,labor-hours,"Defense News - Defense firms outsource sub, carrier construction amid labor woes (M. Eckstein, 2022-10-21)",https://www.defensenews.com/industry/2022/10/21/defense-firms-outsource-sub-carrier-construction-amid-labor-woes/,"RADM Jon Rucker (PEO Attack Submarines): EB outsources 1.1M hrs/yr and Newport News 900,000 hrs; by 2025 that combined 2 million hours will grow to 5 million - which equates to half the work to build a Virginia submarine."
A2,L - shipyard labor share of ship cost,0.40,dollars (of total procurement cost),"O'Rourke (CRS), 'The State of U.S. Shipbuilding', House Armed Services testimony (2025-03-11)",https://armedservices.house.gov/uploadedfiles/03.11.25_spf_state_of_shipbuilding_orourke_statement.pdf,Shipyard labor can account for roughly 40% of a military ship's total procurement cost. (Denominator = total procurement incl. GFE; labor's share of Basic Construction is therefore higher.)
A3,L cross-check - labor weight of shipbuilding cost,0.39-0.48,dollars (composite index weight),"CBO, The Shipbuilding Composite Index (April 2024)",https://www.cbo.gov/publication/60206,"Shipbuilder cost splits into labor, nonnuclear material, and nuclear material (nuclear material includes subcontractor labor). Shipbuilder labor was almost half of the index 2006-2022, declining from 48% (2007) to 39% (2013)."
A4,Basic Construction is a single regulated line (no labor/material split),n/a,definition,"DoD FMR 7000.14-R Vol 2B Ch 4, Exhibit P-5 Ship Cost Element Categories (Nov 2017)",https://comptroller.defense.gov/Portals/45/documents/fmr/current/02b/02b_04.pdf,Ship Cost Element Categories: Plan Costs; Basic Construction/Conversion; Change Orders; Electronics; Propulsion Equipment; HM&E; Other Cost; Ordnance; Escalation; PM Growth; Total Ship Estimate. Basic Construction is one line - the labor/material split is not in the budget.
A5,Virginia current off-team place-of-performance,0.34,place of performance,"DoD Contracts 2019-12-02 (article 2030017), Block V N00024-17-C-2100",https://www.defense.gov/News/Contracts/Contract/Article/2030017/,"Announced POP: other-US (each below 1%, collectively 22%) + outside US (1%) = 34% off the EB/HII prime team; the applied Virginia BC supplier coefficient."
A6,Columbia current off-team place-of-performance,0.22,place of performance,"DoD Contracts 2020-11-05 (article 2406922), Build I N00024-17-C-2117",https://www.defense.gov/Newsroom/Contracts/Contract/Article/2406922/,Announced POP: other US sites each <1% (22%) off the EB/HII prime team; the applied Columbia BC supplier coefficient.
A7,DDG-51 current off-team place-of-performance,0.13,place of performance,"DoD Contracts 2023-08-01 (article 3479250), DDG-51 FY23-27 multiyear (BIW + Ingalls)",https://www.defense.gov/News/Contracts/Contract/Article/3479250/,"DDG-51 off-team construction share ~13%, a production-weighted blend of the BIW and Ingalls FY23-27 multiyear announcements (BIW ~20% off-Bath construction; Ingalls ~9% off-Pascagoula). A narrower measure than the gross announced place of performance, which also counts teammate, engineering, and support sites; the applied DDG-51 BC supplier coefficient and the current-state floor."
